{
  "schemaVersion": 1,
  "format": "hybridclr.dhe-toolchain-manifest.json",
  "generatedAtUtc": "2026-10-04T08:30:25.7330074+00:00",
  "toolchainVersion": "0.1.35",
  "contractVersion": 1,
  "mode": "Exploratory",
  "releaseReady": false,
  "pathSemantics": "package-relative-v1",
  "packageIdAlgorithm": "sha256-canonical-manifest-v2",
  "packageId": "77f7f6ce88dfe781368ee9b54f48f866028a798eda635549440eb00601a63ab3",
  "entryPoint": "HybridCLR.DheTool.dll",
  "commands": [
    "version",
    "mv",
    "metaversion",
    "batch",
    "base-registry",
    "resource-release-build",
    "resource-release-plan",
    "resource-release-qualify",
    "resource-update",
    "stage-resource-update",
    "android-device-smoke",
    "resource-player-evidence",
    "resource-release-gate",
    "channel-state",
    "baseline-manifest",
    "aot-metadata-manifest",
    "preflight",
    "workflow",
    "release-gate",
    "schema-validate",
    "schema-gate",
    "validate",
    "archive",
    "doctor",
    "verify-package",
    "new-adapter",
    "new-config",
    "tree-hash",
    "file-hash"
  ],
  "layoutSha256": "ed9ecf904ad6a163652ddbfc6b0ef8817b3a478323abb2d933654217d0155983",
  "sourceIdentity": {
    "head": "1323dc2747a39bf7e8dc00d5d54ae2d880d85a82",
    "tree": "cd43e59e3d0701aec7e0565c04b45d817073800f",
    "clean": true,
    "tracked": true
  },
  "fileCount": 82,
  "files": [
    {
      "path": "HybridCLR.DheTool.deps.json",
      "size": 810,
      "sha256": "9072be99c13a72e52ce6dd37cead3606b2c06cdeb7b675a681d9fb5ff0f430fa"
    },
    {
      "path": "HybridCLR.DheTool.dll",
      "size": 1613824,
      "sha256": "c5723e4abc1aad6f818efe589aa04b5ae1c43509bb96cedffec01a55155c6003"
    },
    {
      "path": "HybridCLR.DheTool.runtimeconfig.json",
      "size": 253,
      "sha256": "ded3aeb5856a11db0b654a785574490cab55839ebfb17efe9e39b89618fc5b91"
    },
    {
      "path": "build-provenance.json",
      "size": 973,
      "sha256": "296818123d54c12e74a23e9896e62025ad4e12896eb2bfa341466075f9f93bf5"
    },
    {
      "path": "dhe-source-boundary.json",
      "size": 488,
      "sha256": "977e3eccc600b1b1e05b410e553a997d20dd428a3313fa10ef6dd7c6495e9987"
    },
    {
      "path": "dnlib.dll",
      "size": 1175040,
      "sha256": "bb83dedc11d6ec41a4ae8f289cc1a35231be7e53e09fd7359c5c10dfbb9bfe5c"
    },
    {
      "path": "docs/DHE-Tool-Binary-Notices.md",
      "size": 1559,
      "sha256": "ab82a53d02d0991d0b4e6cc26b7edabdf08c7b73b44a4e790beb8a66d6f59029"
    },
    {
      "path": "docs/THIRD-PARTY-NOTICES.md",
      "size": 1397,
      "sha256": "aa996d654bf6d0dd8ac72354f2760a7b5e766fb0a25ee2306b9d015038473809"
    },
    {
      "path": "manifests/dhe-toolchain-evidence-authorities.json",
      "size": 4363,
      "sha256": "c4ea54c13fadea127673cbe2196af8389a28e9efccd6469de9b67c3962ea28b3"
    },
    {
      "path": "manifests/dhe-toolchain-layout.json",
      "size": 1220,
      "sha256": "ed9ecf904ad6a163652ddbfc6b0ef8817b3a478323abb2d933654217d0155983"
    },
    {
      "path": "manifests/runtime-workflows.json",
      "size": 1140,
      "sha256": "02d79ed2718e6f7cd2052ee8b5ce78035930134d79f922abe9ba06b1fff98411"
    },
    {
      "path": "schemas/dhe-adapter-native-finalize.schema.json",
      "size": 5139,
      "sha256": "876309b5455682ce3a45088456a84c306c538eee93dba63e7fe72ae8581bdad1"
    },
    {
      "path": "schemas/dhe-adapter-native-guards.schema.json",
      "size": 1717,
      "sha256": "53a30bd34e76eb6b9d73b8d7ad60e1db003608ab2b09772f6fff32943b9ffa79"
    },
    {
      "path": "schemas/dhe-adapter-player-build.schema.json",
      "size": 775,
      "sha256": "a36b4da8eaa26221870a99571aba2b8d1bfc1c284aaf94c62c241167c8aef022"
    },
    {
      "path": "schemas/dhe-adapter-stage.schema.json",
      "size": 1017,
      "sha256": "0a73521b1f761941e054a91b5584d2346195b222ec15f3bd87e4a599f42a224c"
    },
    {
      "path": "schemas/dhe-aot-metadata-manifest.schema.json",
      "size": 2781,
      "sha256": "88b5113e6e62f63d4be7bc9b4c09fee786f6e934f54cb424797ce9150bbc13a9"
    },
    {
      "path": "schemas/dhe-archive-gate.schema.json",
      "size": 1078,
      "sha256": "7e0155bcb6abf997d6170f007558936a37f9aa06078f1a409ae804686c4fd1c0"
    },
    {
      "path": "schemas/dhe-archive-manifest.schema.json",
      "size": 4445,
      "sha256": "8e2aee35d57fb4c475e13d92f01e4a5efa315f0301f1be9505e2f80ba5cdf5ed"
    },
    {
      "path": "schemas/dhe-artifact-validation.schema.json",
      "size": 1628,
      "sha256": "45caf678e5aeb6194c27d676e99cee3b259dd837c51d0c7fc581c80ffa6aadf1"
    },
    {
      "path": "schemas/dhe-base-registry.schema.json",
      "size": 2432,
      "sha256": "ce2a715e41a7646b7c6d7ff09e96f22ff4172eaca5539e001c5707f2e6b001bd"
    },
    {
      "path": "schemas/dhe-base-runner-catalog.schema.json",
      "size": 2286,
      "sha256": "2aa18201df825d7e1377f5e29779133abe305c3c6ea174f634af59d2d3e1364b"
    },
    {
      "path": "schemas/dhe-baseline-manifest.schema.json",
      "size": 2577,
      "sha256": "cea61c5f0fb449af545b01b0a1125e5f5c6dd630df45a1cb2fc202fe3b8961e1"
    },
    {
      "path": "schemas/dhe-batch-report.schema.json",
      "size": 3184,
      "sha256": "5a7ab481a8b2b36347d1e047bec772c900fda57d63b5be73e898b79bea87c4eb"
    },
    {
      "path": "schemas/dhe-build-identity.schema.json",
      "size": 4816,
      "sha256": "0ffce44cd5b87ce1f3e71b89feca925e6faeea0248ac34e043e7a342e5e8206d"
    },
    {
      "path": "schemas/dhe-channel-snapshot.schema.json",
      "size": 4539,
      "sha256": "e780f6f5e239b29680aca68beb58f3a72432bba67f2c9228ef9a621ace0ebc3b"
    },
    {
      "path": "schemas/dhe-channel-state.schema.json",
      "size": 4268,
      "sha256": "41f639ed19514378d35dcd060a396eca0075cfbe0c4c8939bef0be0946979b3a"
    },
    {
      "path": "schemas/dhe-clean-checkout-gate.schema.json",
      "size": 4387,
      "sha256": "1f150a14201cfc1876e29892902490dd3e9bfa6f5e6f4f411aae644d6a053c73"
    },
    {
      "path": "schemas/dhe-cpp-resolver-regression.schema.json",
      "size": 1981,
      "sha256": "537d769ef008de266d59cc871d2e8a5987e369e4e6f7c7e3747f869418315e98"
    },
    {
      "path": "schemas/dhe-device-player-run.schema.json",
      "size": 4541,
      "sha256": "919547961dd45f264e4e7a974f854414d61499a1c3d687c9a104af5a57a8688f"
    },
    {
      "path": "schemas/dhe-metaversion.schema.json",
      "size": 3589,
      "sha256": "64e8a97cd587ceba68e9aa959ab450f4bba1fa0bcb5c080bbaf57fa7987d49da"
    },
    {
      "path": "schemas/dhe-native-gate.schema.json",
      "size": 1603,
      "sha256": "1b55f2108d8295996f294a1a5e292618d0875953a81b5fc501864500dd68839e"
    },
    {
      "path": "schemas/dhe-native-manifest.schema.json",
      "size": 7037,
      "sha256": "786ade87016c1627fe40d07641999fa283f2509d1e93ea612c029002528ba3cb"
    },
    {
      "path": "schemas/dhe-package-lock.schema.json",
      "size": 1695,
      "sha256": "67dc318431d509aa81b8ccc896d50745f9bc21a4ae7af2dea643d58f071119f3"
    },
    {
      "path": "schemas/dhe-player-result.schema.json",
      "size": 23005,
      "sha256": "f54e153e759ca2e403ae686dd8a43ba3fae87b2626108238e7106759b38c1855"
    },
    {
      "path": "schemas/dhe-project-adapter-prepare.schema.json",
      "size": 1421,
      "sha256": "d055ec0131a85bf72338534c4a43a183b08904124d0d681003535ed128f44868"
    },
    {
      "path": "schemas/dhe-project-plan-validation.schema.json",
      "size": 1049,
      "sha256": "0ee3a29921e51b800203e9aa1d6118e7f7ace4245991e768857063185eb4da64"
    },
    {
      "path": "schemas/dhe-project-plan.schema.json",
      "size": 2669,
      "sha256": "d4a2102bce27b03d011bc2e0cf66ba3985134e8d5eb4fffd9745ac2268c66508"
    },
    {
      "path": "schemas/dhe-project-preflight-failure.schema.json",
      "size": 1546,
      "sha256": "13efeb69bd589bbee97464922d71b1425d0c0312a5ebb08a4b4c386d9480fca2"
    },
    {
      "path": "schemas/dhe-project-preflight.schema.json",
      "size": 2123,
      "sha256": "b060c654a200af01f4cec61324497cde1cd930394fb60344ca4e4aae457d179e"
    },
    {
      "path": "schemas/dhe-project-workflow-failure.schema.json",
      "size": 1984,
      "sha256": "ba74753ddd80e75899fbcaa074d85d5a323b24450e7673cf0f54f849484f63f2"
    },
    {
      "path": "schemas/dhe-project-workflow.schema.json",
      "size": 3183,
      "sha256": "41ba400f17e4406c085494fff0dd09521c25d071fed8415a2c8196178a2c03da"
    },
    {
      "path": "schemas/dhe-regression.schema.json",
      "size": 4535,
      "sha256": "f532b440f15068eb271d6d8f907243903768ff409ded0ac62667d968b1256660"
    },
    {
      "path": "schemas/dhe-release-gate.schema.json",
      "size": 4761,
      "sha256": "f7981e8b70cc6493e3ce5cb2cdb71be37323d09e069482ec41099db472c1db4b"
    },
    {
      "path": "schemas/dhe-release-ledger.schema.json",
      "size": 2425,
      "sha256": "97e26b98321eccaaf8b92dcca92b0c850e924ad50f0e5e40d503889c83dc8bb8"
    },
    {
      "path": "schemas/dhe-resource-evidence.schema.json",
      "size": 1575,
      "sha256": "386ad27289f77da05fe7ab1591ad13b6369ea5f90b14eb66cf807742e6698cad"
    },
    {
      "path": "schemas/dhe-resource-player-workflow.schema.json",
      "size": 11400,
      "sha256": "90d539a5eaf74a8c0af657f1138c7f483176cbf7a33b9a30476c8aa50bee09dd"
    },
    {
      "path": "schemas/dhe-resource-release-build-config.schema.json",
      "size": 3652,
      "sha256": "ef1f1d20871277e80b5c7d29ddb3013b2b4f208c2baa3b11fc6992917c0b5522"
    },
    {
      "path": "schemas/dhe-resource-release-build.schema.json",
      "size": 6660,
      "sha256": "2890342f7bc9230d2517cc551ee4a51be20215ce9ccf096fe4cc3880a8103f4d"
    },
    {